{
  "urn": "media:mem-cleanup-interval-seconds;setting;textable;numeric",
  "media_type": "text/plain",
  "title": "Memory cleanup interval in seconds",
  "profile_uri": "https://capdag.com/schema/mem-cleanup-interval-seconds",
  "description": "Memory cleanup interval in seconds",
  "metadata": {
    "category": "mem",
    "subcategory": "mem_management",
    "display_index": 1,
    "ui_type": "SETTING_UI_TYPE_NUMBER_FIELD",
    "data_type": "SETTING_DATA_TYPE_UNSIGNED_INTEGER",
    "default": 30,
    "overridable_by": [
      "user"
    ]
  },
  "validation": {
    "min": 10,
    "max": 3600
  }
}