{
  "urn": "media:inference-guidance-step-max-items;setting;textable;numeric",
  "media_type": "text/plain",
  "title": "Maximum items per step for guidance",
  "profile_uri": "https://capdag.com/schema/inference-guidance-step-max-items",
  "description": "Maximum items per step for guidance",
  "metadata": {
    "category": "inference",
    "subcategory": "inference_advanced",
    "display_index": 16,
    "ui_type": "SETTING_UI_TYPE_NUMBER_FIELD",
    "data_type": "SETTING_DATA_TYPE_UNSIGNED_INTEGER",
    "default": 50000,
    "overridable_by": [
      "cap",
      "model",
      "user"
    ]
  },
  "validation": {
    "min": 1000,
    "max": 100000
  }
}