{
  "urn": "media:srv-cap-filter-by-availability;setting;textable",
  "media_type": "text/plain",
  "title": "Filter cap paths by availability",
  "profile_uri": "https://capdag.com/schema/srv-cap-filter-by-availability",
  "description": "Filter cap paths by availability",
  "metadata": {
    "category": "srv",
    "subcategory": "srv_network",
    "display_index": 3,
    "ui_type": "SETTING_UI_TYPE_SWITCH",
    "data_type": "SETTING_DATA_TYPE_BOOLEAN",
    "default": true,
    "overridable_by": [
      "user",
      "end_user"
    ]
  }
}