{
  "urn": "media:mem-monitor-interval-ms;setting;textable;numeric",
  "media_type": "text/plain",
  "title": "Memory monitoring interval in milliseconds",
  "profile_uri": "https://capdag.com/schema/mem-monitor-interval-ms",
  "description": "Memory monitoring interval in milliseconds",
  "metadata": {
    "category": "mem",
    "subcategory": "mem_monitoring",
    "display_index": 3,
    "ui_type": "SETTING_UI_TYPE_NUMBER_FIELD",
    "data_type": "SETTING_DATA_TYPE_UNSIGNED_INTEGER",
    "default": 1000,
    "overridable_by": [
      "user"
    ]
  },
  "validation": {
    "min": 100,
    "max": 10000
  }
}