{
  "urn": "media:api-cache-ttl-seconds;setting;textable;numeric",
  "media_type": "text/plain",
  "title": "Cache TTL in seconds",
  "profile_uri": "https://capdag.com/schema/api-cache-ttl-seconds",
  "description": "Cache TTL in seconds",
  "metadata": {
    "category": "api",
    "subcategory": "api_configuration",
    "display_index": 1,
    "ui_type": "SETTING_UI_TYPE_NUMBER_FIELD",
    "data_type": "SETTING_DATA_TYPE_UNSIGNED_INTEGER",
    "default": 3600,
    "overridable_by": [
      "user"
    ]
  },
  "validation": {
    "min": 60,
    "max": 86400
  }
}