{
  "urn": "media:test-data-directory;setting;textable",
  "media_type": "text/plain",
  "title": "Directory for test data",
  "profile_uri": "https://capdag.com/schema/test-data-directory",
  "description": "Directory for test data",
  "metadata": {
    "category": "test",
    "subcategory": "test_configuration",
    "display_index": 1,
    "ui_type": "SETTING_UI_TYPE_FOLDER_PICKER",
    "data_type": "SETTING_DATA_TYPE_STRING",
    "default": "tests/fixtures",
    "overridable_by": []
  }
}