{
  "urn": "media:max-concurrent-tasks;tasks;limit;operator;app;textable;numeric",
  "media_type": "text/plain",
  "title": "Maximum number of concurrent tasks",
  "profile_uri": "https://capdag.com/schema/task-max-concurrent-tasks",
  "description": "Maximum number of concurrent tasks",
  "metadata": {
    "category": "task",
    "subcategory": "task_execution",
    "display_index": 2,
    "ui_type": "SETTING_UI_TYPE_NUMBER_FIELD",
    "data_type": "SETTING_DATA_TYPE_UNSIGNED_INTEGER",
    "default": 10,
    "overridable_by": [
      "user"
    ]
  },
  "validation": {
    "min": 1,
    "max": 100
  }
}