{
  "urn": "media:model-idle-timeout-minutes;memory;timing;operator;model;textable;numeric",
  "media_type": "text/plain",
  "title": "Model idle timeout in minutes",
  "profile_uri": "https://capdag.com/schema/mem-model-idle-timeout-minutes",
  "description": "Model idle timeout in minutes",
  "metadata": {
    "category": "mem",
    "subcategory": "mem_management",
    "display_index": 7,
    "ui_type": "SETTING_UI_TYPE_NUMBER_FIELD",
    "data_type": "SETTING_DATA_TYPE_UNSIGNED_INTEGER",
    "default": 30,
    "overridable_by": [
      "model",
      "user"
    ]
  },
  "validation": {
    "min": 1,
    "max": 1440
  }
}