{
  "urn": "media:mem-available-memory-warning-mb;setting;textable;numeric",
  "media_type": "text/plain",
  "title": "Warning threshold for available memory in MB",
  "profile_uri": "https://capdag.com/schema/mem-available-memory-warning-mb",
  "description": "Warning threshold for available memory in MB",
  "metadata": {
    "category": "mem",
    "subcategory": "mem_thresholds",
    "display_index": 5,
    "ui_type": "SETTING_UI_TYPE_NUMBER_FIELD",
    "data_type": "SETTING_DATA_TYPE_UNSIGNED_INTEGER",
    "default": 4096,
    "overridable_by": [
      "cap",
      "model",
      "user"
    ]
  },
  "validation": {
    "min": 256,
    "max": 32768
  }
}