{
  "urn": "media:mem-max-concurrent-models;setting;textable;numeric",
  "media_type": "text/plain",
  "title": "Maximum concurrent models in memory",
  "profile_uri": "https://capdag.com/schema/mem-max-concurrent-models",
  "description": "Maximum concurrent models in memory",
  "metadata": {
    "category": "mem",
    "subcategory": "mem_management",
    "display_index": 5,
    "ui_type": "SETTING_UI_TYPE_NUMBER_FIELD",
    "data_type": "SETTING_DATA_TYPE_UNSIGNED_INTEGER",
    "default": 2,
    "overridable_by": [
      "cap",
      "model",
      "user"
    ]
  },
  "validation": {
    "min": 1,
    "max": 10
  }
}