{
  "urn": "media:task-enable-task-scheduling;setting;textable",
  "media_type": "text/plain",
  "title": "Enable task scheduling",
  "profile_uri": "https://capdag.com/schema/task-enable-task-scheduling",
  "description": "Enable task scheduling",
  "metadata": {
    "category": "task",
    "subcategory": "task_scheduling",
    "display_index": 4,
    "ui_type": "SETTING_UI_TYPE_CHECKBOX",
    "data_type": "SETTING_DATA_TYPE_BOOLEAN",
    "default": true,
    "overridable_by": [
      "user"
    ]
  }
}