{
  "urn": "media:inference-guidance-step-lexer-fuel;setting;textable;numeric",
  "media_type": "text/plain",
  "title": "Step lexer fuel for guidance",
  "profile_uri": "https://capdag.com/schema/inference-guidance-step-lexer-fuel",
  "description": "Step lexer fuel for guidance",
  "metadata": {
    "category": "inference",
    "subcategory": "inference_advanced",
    "display_index": 15,
    "ui_type": "SETTING_UI_TYPE_NUMBER_FIELD",
    "data_type": "SETTING_DATA_TYPE_UNSIGNED_INTEGER",
    "default": 200000,
    "overridable_by": [
      "cap",
      "model",
      "user"
    ]
  },
  "validation": {
    "min": 1000,
    "max": 1000000
  }
}